{
  "decision": "approved",
  "remaining_escalations": [],
  "git_object_format": "sha1",
  "preflight_release_id": "git-1a2a41541399",
  "preflight_release_source_commit": "1a2a41541399286b9fd44e3af2f4d5c52088ee02",
  "plan_sha256": "4f64e866791d55326968f1a9a29ded21683e8067b7767c752c310c6dc43d7424",
  "blueprint_sha256": "42359ec4ba95529998106cc1171fa5ba37a0b1d0848e6880d004b25df43c9db5",
  "research_authority_sha256": "8dca1748a211b9eaf9df5d392d7d39d755cbe3946a358c11cff2f51c5323d91d",
  "review_schema_sha256": "e4c70d14b555ae3da219e299e4b7e498c457ca44a96bc1f5e9e23d42fcdded83",
  "contract_decisions_sha256": "7128ba550d7bc6d4fca0f1c9b806bcf9887e4be23eb4c1f65606bf6a50b8c525",
  "decision_contract_sha256": "d6e200359cd9e756597d7c216cdc020897bfbdd076e5665b98c7d2b2406a05a8",
  "schema_inventory_sha256": "7c2378e98b9444b59c9afa0fbbfd4e8334c6d85868ed7db2a9728b23560efd88"
}
